{
  "generatedAt": "2026-10-12T04:50:13.206Z",
  "metadata": {
    "nodeCount": 47,
    "edgeCount": 86,
    "orphanCount": 0
  },
  "nodes": [
    {
      "id": "index",
      "title": "Wiki Index",
      "path": "index.md",
      "folder": "root",
      "tags": [],
      "aliases": [],
      "excerpt": "Navigation layer, not a content replica. Major entry points with one-sentence descriptions. If this file starts reading like a table of contents for every page, it has stopped working — the rules are...",
      "outgoingCount": 1,
      "incomingCount": 0,
      "isOrphan": false
    },
    {
      "id": "log",
      "title": "Operation Log",
      "path": "log.md",
      "folder": "root",
      "tags": [],
      "aliases": [],
      "excerpt": "Append-only. Every completed write operation gets one entry. Newest at the bottom.",
      "outgoingCount": 0,
      "incomingCount": 1,
      "isOrphan": false
    },
    {
      "id": "concepts/Agentic AI",
      "title": "Agentic AI",
      "path": "concepts/Agentic AI.md",
      "folder": "concepts",
      "tags": [
        "ai",
        "agents",
        "langgraph"
      ],
      "aliases": [
        "Agentic Artificial Intelligence"
      ],
      "excerpt": "Agentic AI refers to an artificial intelligence system capable of making decisions and taking actions autonomously to achieve a specific goal without requiring step-by-step human instructions, though...",
      "outgoingCount": 3,
      "incomingCount": 6,
      "isOrphan": false
    },
    {
      "id": "concepts/Antigravity Sandbox Isolation",
      "title": "Antigravity Sandbox Isolation",
      "path": "concepts/Antigravity Sandbox Isolation.md",
      "folder": "concepts",
      "tags": [
        "sandbox",
        "security",
        "antigravity",
        "cli"
      ],
      "aliases": [
        "Agy Sandbox"
      ],
      "excerpt": "Antigravity Sandbox Isolation is the architectural pattern of running the Antigravity CLI (agy) entirely within a controlled Docker sbx container environment, ensuring the host machine remains insulat...",
      "outgoingCount": 1,
      "incomingCount": 1,
      "isOrphan": false
    },
    {
      "id": "concepts/Application Programming Interface (API)",
      "title": "Application Programming Interface (API)",
      "path": "concepts/Application Programming Interface (API).md",
      "folder": "concepts",
      "tags": [
        "architecture",
        "web",
        "rest"
      ],
      "aliases": [
        "API",
        "APIs",
        "REST",
        "RESTful"
      ],
      "excerpt": "An Application Programming Interface (API) is a formalized entry point exposed by an application to allow external clients to invoke code or manipulate internal data. Over a network context, these end...",
      "outgoingCount": 1,
      "incomingCount": 1,
      "isOrphan": false
    },
    {
      "id": "concepts/Asynchronous Programming",
      "title": "Asynchronous Programming",
      "path": "concepts/Asynchronous Programming.md",
      "folder": "concepts",
      "tags": [
        "programming",
        "async"
      ],
      "aliases": [
        "Async",
        "Asynchronous"
      ],
      "excerpt": "A programming paradigm that allows code to handle multiple tasks concurrently without blocking the program's execution, primarily used for I/O-bound tasks to allow other operations to proceed while wa...",
      "outgoingCount": 2,
      "incomingCount": 3,
      "isOrphan": false
    },
    {
      "id": "concepts/Claude Code Sandbox Execution",
      "title": "Claude Code Sandbox Execution",
      "path": "concepts/Claude Code Sandbox Execution.md",
      "folder": "concepts",
      "tags": [
        "sandbox",
        "security",
        "claude-code",
        "cli",
        "agentic-ai"
      ],
      "aliases": [
        "Claude Code sbx"
      ],
      "excerpt": "Claude Code Sandbox Execution refers to the workflow and configuration mechanisms for running the Claude Code agentic AI safely and scalably inside a Docker sbx container environment.",
      "outgoingCount": 2,
      "incomingCount": 1,
      "isOrphan": false
    },
    {
      "id": "concepts/Fast Node Manager (FNM) Windows Initialization",
      "title": "Fast Node Manager (FNM) Windows Initialization",
      "path": "concepts/Fast Node Manager (FNM) Windows Initialization.md",
      "folder": "concepts",
      "tags": [
        "node",
        "fnm",
        "windows",
        "powershell"
      ],
      "aliases": [
        "FNM Initialization"
      ],
      "excerpt": "Fast Node Manager (FNM) uses dynamic shell initialization rather than static system environment variables to manage Node.js versions. To expose node and npm, the shell must run fnm env at startup to i...",
      "outgoingCount": 1,
      "incomingCount": 1,
      "isOrphan": false
    },
    {
      "id": "concepts/File IO (Python)",
      "title": "File IO (Python)",
      "path": "concepts/File IO (Python).md",
      "folder": "concepts",
      "tags": [
        "python",
        "io",
        "csv"
      ],
      "aliases": [
        "Python File IO"
      ],
      "excerpt": "File I/O in Python refers to the built-in mechanisms for opening, reading, and writing files, primarily utilizing the open() function and context management for safe resource handling.",
      "outgoingCount": 2,
      "incomingCount": 3,
      "isOrphan": false
    },
    {
      "id": "concepts/Hard vs Soft Links (Linux)",
      "title": "Hard vs Soft Links (Linux)",
      "path": "concepts/Hard vs Soft Links (Linux).md",
      "folder": "concepts",
      "tags": [
        "linux",
        "filesystem"
      ],
      "aliases": [
        "Symlinks",
        "Soft Links",
        "Hard Links"
      ],
      "excerpt": "In Linux, the ln command creates links to files, allowing multiple paths to reference the same data. These links come in two distinct architectural forms: hard links and soft (symbolic) links Source -...",
      "outgoingCount": 2,
      "incomingCount": 2,
      "isOrphan": false
    },
    {
      "id": "concepts/LangChain",
      "title": "LangChain",
      "path": "concepts/LangChain.md",
      "folder": "concepts",
      "tags": [
        "framework",
        "langchain"
      ],
      "aliases": [],
      "excerpt": "LangChain is a framework providing the foundational building blocks for Large Language Model (LLM) applications, such as prompts, tools, and retrievers, organized primarily as linear workflows.",
      "outgoingCount": 2,
      "incomingCount": 2,
      "isOrphan": false
    },
    {
      "id": "concepts/LangGraph Async Execution",
      "title": "LangGraph Async Execution",
      "path": "concepts/LangGraph Async Execution.md",
      "folder": "concepts",
      "tags": [
        "langgraph",
        "async",
        "architecture"
      ],
      "aliases": [],
      "excerpt": "LangGraph Async Execution refers to the architectural patterns required to safely run LangGraph agent graphs asynchronously, particularly in high-concurrency environments like web APIs (e.g., FastAPI)...",
      "outgoingCount": 3,
      "incomingCount": 2,
      "isOrphan": false
    },
    {
      "id": "concepts/LangGraph",
      "title": "LangGraph",
      "path": "concepts/LangGraph.md",
      "folder": "concepts",
      "tags": [
        "agents",
        "langchain",
        "framework"
      ],
      "aliases": [],
      "excerpt": "LangGraph is a framework used to construct and manage LLM-based agents and multi-agent systems. It models logic as a flowchart engine for LLMs, defining nodes (tasks), edges (routing), and state, rath...",
      "outgoingCount": 6,
      "incomingCount": 6,
      "isOrphan": false
    },
    {
      "id": "concepts/LangServe",
      "title": "LangServe",
      "path": "concepts/LangServe.md",
      "folder": "concepts",
      "tags": [
        "deployment",
        "api",
        "langchain"
      ],
      "aliases": [],
      "excerpt": "LangServe is a deployment tool used to create APIs for LLM applications.",
      "outgoingCount": 1,
      "incomingCount": 1,
      "isOrphan": false
    },
    {
      "id": "concepts/LangSmith",
      "title": "LangSmith",
      "path": "concepts/LangSmith.md",
      "folder": "concepts",
      "tags": [
        "observability",
        "llmops",
        "langchain"
      ],
      "aliases": [],
      "excerpt": "LangSmith is an LLMOps platform designed by the LangChain team for debugging, monitoring, and evaluating applications and AI agents. It functions independently of LangChain and records complete execut...",
      "outgoingCount": 2,
      "incomingCount": 2,
      "isOrphan": false
    },
    {
      "id": "concepts/Linux Basics",
      "title": "Linux Basics",
      "path": "concepts/Linux Basics.md",
      "folder": "concepts",
      "tags": [
        "linux",
        "os",
        "filesystem"
      ],
      "aliases": [
        "Linux Commands"
      ],
      "excerpt": "Basic Linux operations revolve around command-line utilities for navigating and manipulating the POSIX filesystem.",
      "outgoingCount": 2,
      "incomingCount": 4,
      "isOrphan": false
    },
    {
      "id": "concepts/Multipass",
      "title": "Multipass",
      "path": "concepts/Multipass.md",
      "folder": "concepts",
      "tags": [
        "linux",
        "virtualization",
        "ubuntu"
      ],
      "aliases": [],
      "excerpt": "Multipass is a command-line tool designed to quickly orchestrate, launch, and manage Ubuntu system virtual machines Source - Linux Commands and Vim Operations.",
      "outgoingCount": 2,
      "incomingCount": 1,
      "isOrphan": false
    },
    {
      "id": "concepts/Object Oriented Programming (Python)",
      "title": "Object Oriented Programming (Python)",
      "path": "concepts/Object Oriented Programming (Python).md",
      "folder": "concepts",
      "tags": [
        "python",
        "oop",
        "architecture"
      ],